ID	text	acronyms	long-forms	acronyms-text	long-forms-text
1	the World Food Programme 1. In its decision 2002/4 of 5 February 2002, the Executive Board of the United Nations Development Programme (UNDP) and of the United Nations Population Fund (UNFPA) took note of the reports to the Economic and Social Council (DP/2002/7 and DP/FPA/2002/1). 	[[136, 140], [185, 190]]	[[98, 134]]	['UNDP', 'UNFPA']	['United Nations Development Programme']
2	These legal transport systems in Europe constitute useful models, which can be adapted in developing countries.  Economic Commission for Latin America and the Caribbean (ECLAC)The full text of the reply has been issued in UNCTAD/LDC/Misc.28 The Economic Commission for Latin America and the Caribbean (ECLAC) supports South America's two landlocked countries - Bolivia and Paraguay - in their efforts to improve transport and customs transit facilities across neighbouring countries for access to seaports.	[[170, 175], [302, 307], [222, 228], [229, 232], [233, 237]]	[[113, 168], [245, 300]]	['ECLAC', 'ECLAC', 'UNCTAD', 'LDC', 'Misc']	['Economic Commission for Latin America and the Caribbean', 'Economic Commission for Latin America and the Caribbean']
3	As a final word of caution against approaches that neglect human rights, the Marangopoulos Foundation would like to underscore its dismay at attempts, in the current socio-economic environment, to erode the gains achieved through gender-based affirmative action.  It therefore strongly supports the stance of the Executive Director of the United Nations Entity for Gender Equality and the Empowerment of Women (UN-Women), Under-Secretary-General Michelle Bachelet, in encouraging countries to resort to or preserve quotas to enhance women's participation in politics. 	[[411, 419]]	[[339, 409]]	['UN-Women']	['United Nations Entity for Gender Equality and the Empowerment of Women']
4	Calls upon Governments, civil society, including the media, and nongovernmental organizations to promote human rights education and full respect for and the enjoyment of the human rights of the girl child, inter alia, through the translation, production and dissemination of ageappropriate and gendersensitive information material on those rights to all sectors of society, in particular to children; 38. Requests the SecretaryGeneral, as Chair of the United Nations System Chief Executives Board for Coordination, to ensure that all organizations and bodies of the United Nations system, individually and collectively, in particular the United Nations Children's Fund, the United Nations Educational, Scientific and Cultural Organization, the World Food Programme, the United Nations Population Fund, the United Nations Entity for Gender Equality and the Empowerment of Women (UNWomen), the World Health Organization, the United Nations Development Programme, the Office of the United Nations High Commissioner for Refugees and the International Labour Organization, take into account the rights and the particular needs of the girl child in country programmes of cooperation in accordance with national priorities, including through the United Nations Development Assistance Framework; 39.	[[878, 885]]	[[806, 876]]	['UNWomen']	['United Nations Entity for Gender Equality and the Empowerment of Women']
5	Grand total 30 320a Abbreviations: AOS = administrative and operational services; GEF = Global Environment Facility; SPPD = support for policy and programme development; STS = support for technical services; TRAC = target for resource assignment from the core; and UNCDF = United Nations Capital Development Fund. 	[[35, 38], [82, 85], [117, 121], [170, 173], [208, 212], [265, 270]]	[[41, 80], [88, 115], [176, 206], [215, 259], [273, 312], [124, 168]]	['AOS', 'GEF', 'SPPD', 'STS', 'TRAC', 'UNCDF']	['administrative and operational services', 'Global Environment Facility', 'support for technical services', 'target for resource assignment from the core', 'United Nations Capital Development Fund', 'support for policy and programme development']
6	The work would contribute to the preparations for the ministerial conference of the World Trade Organization (WTO), due to be held in November/December 1999, only a few months before UNCTAD X, since many of the issues related to the Positive Agenda were relevant to the work of WTO.  The work had included the organization of two ad hoc expert meetings and the preparation of the studies presented at those meetings, at which other organizations, notably WTO, the World Bank and the International Trade Centre UNCTAD/WTO (ITC), had taken a full part. 	[[522, 525], [110, 113], [183, 191], [278, 281], [330, 336], [455, 459], [517, 520], [510, 517]]	[[483, 509], [84, 108]]	['ITC', 'WTO', 'UNCTAD X', 'WTO', 'ad hoc', 'WTO,', 'WTO', 'UNCTAD/']	['International Trade Centre', 'World Trade Organization']
7	 12. This report is drafted with the input of relevant Government Institutions and Non - Governmental Organizations (NGO'S). 	[[117, 122]]	[[83, 115]]	"[""NGO'S""]"	['Non - Governmental Organizations']
8	Medicine, Dentistry Economics and Management science Technical Institutes (IUT's) Material and structural sciences	[[75, 80]]	[]	"[""IUT's""]"	[]
9	 6. The Consumer Price Index for All Urban Consumers (CPI-U), the headline American CPI, estimates price change for the non-institutional urban population. 	[[54, 59], [84, 87]]	[[8, 52]]	['CPI-U', 'CPI']	['Consumer Price Index for All Urban Consumers']
10	In 2007, UIRR unaccompanied road-rail transport (containers, swap-bodies and semi-trailers) has risen by 10 per cent to reach 2.56 million consignments.  Accompanied road-rail transport (Rolling Highway (RoLa)) increased by around 2 per cent and reached 390.000 consignments. 	[[204, 208], [9, 13]]	[[187, 202], [14, 47]]	['RoLa', 'UIRR']	['Rolling Highway', 'unaccompanied road-rail transport']
11	WTO EUROSTAT: Committee: Trading of Goods - Intrastat/Extrastat (joint with EDICOM - Electronic Data Interchange for the Commission), 13-15 November 2002 (+ 3 times a year in March, June and November) EUROSTAT: Working Group: EDICOM Information & Communication Technology (EDICOM-ITC), 14-15 October 2002 (+ twice a year in February and October) OECD: Trade Indicators Roundtable, 2002	[[273, 283], [4, 12], [0, 3], [76, 82], [346, 350]]	[[226, 271], [85, 132]]	['EDICOM-ITC', 'EUROSTAT', 'WTO', 'EDICOM', 'OECD']	['EDICOM Information & Communication Technology', 'Electronic Data Interchange for the Commission)']
12	Hayes Alto Paraguay MA = Medical attendance present No MA = No medical attendance present	[[20, 22], [52, 57]]	[[25, 43], [60, 81]]	['MA', 'No MA']	['Medical attendance', 'No medical attendance']
13	21).  The group of volunteers was asked to consider possible incorporation of this part of the Russian proposal into the draft amended text of chapter 10B (TRANS/SC.3/WP.3/AC.2/2000/1/Add.1) taking into account provisions in force within the Central Commission for the Navigation of the Rhine (CCNR) and the Danube Commission as reflected in TRANS/SC.3/WP.3/R.28 and Corr.1 and in TRANS/SC.3/WP.3/R.68. 	[[294, 298], [156, 164], [184, 189], [167, 171], [171, 176], [342, 350], [367, 373], [353, 357], [358, 362]]	[[242, 292]]	['CCNR', 'TRANS/SC', 'Add.1', 'WP.3', '/AC.2', 'TRANS/SC', 'Corr.1', 'WP.3', 'R.28']	['Central Commission for the Navigation of the Rhine']
14	"Notes that paragraph 48 of the gender equality strategy will be replaced by the following paragraph: ""All country offices will present a plan to ensure they have the necessary gender expertise for their specific programme and country context, noting that offices with a portfolio over $25 million (at current funding levels, 40 country offices) would be expected to have a dedicated gender adviser in their office or equivalent dedicated capacity, bearing in mind that resource allocation is done on the basis of the United Nations Development Assistance Framework in consultation with the programme country.  Country offices will be encouraged to explore with partner agencies, in particular with the United Nations Entity for Gender Equality and the Empowerment of Women (UN-Women), opportunities to leverage their expertise.""; "	[[774, 782]]	[[702, 772]]	['UN-Women']	['United Nations Entity for Gender Equality and the Empowerment of Women']
15	"22).]  UNU Midday Forum on ""Environment and migration in the Caribbean"" (organized by the United Nations University Office in New York (UNU-ONY)) From 1.15 to 2.30 p.m. in Conference Room 7 (NLB)."	[[136, 143], [7, 10], [164, 168], [191, 194]]	[[90, 134]]	['UNU-ONY', 'UNU', 'p.m.', 'NLB']	['United Nations University Office in New York']
16	Calls upon States, the United Nations system, civil society and all stakeholders to continue to observe 6 February as the International Day of Zero Tolerance for Female Genital Mutilation and to use the day to enhance awareness-raising campaigns and to take concrete actions against female genital mutilations; 22. Requests the SecretaryGeneral to ensure that all relevant organizations and bodies of the United Nations system, in particular the United Nations Population Fund, the United Nations Children's Fund, the United Nations Entity for Gender Equality and the Empowerment of Women (UNWomen), the World Health Organization, the United Nations Educational, Scientific and Cultural Organization, the United Nations Development Programme and the Office of the United Nations High Commissioner for Human Rights, individually and collectively, take into account the protection and promotion of the rights of women and girls against female genital mutilations in their country programmes, as appropriate and in accordance with national priorities, in order to further strengthen their efforts in this regard; 23.	[[590, 597]]	[[518, 588]]	['UNWomen']	['United Nations Entity for Gender Equality and the Empowerment of Women']
17	In 2013, IEO was a contributing partner in the first joint evaluation of joint gender programmes in the United Nations system.  Starting in 2012, seven partners - UNDP, UNFPA, the United Nations Children's Fund, the United Nations Entity for Gender Equality and Empowerment of Women (UN-Women), the Millennium Development Goal Achievement Fund and the Governments of Norway and Spain - came together to commission and oversee the reporting effort. 	[[284, 292], [9, 12], [163, 167], [169, 174]]	[[216, 282]]	['UN-Women', 'IEO', 'UNDP', 'UNFPA']	['United Nations Entity for Gender Equality and Empowerment of Women']
18	Korea Testing & Research Institute (KTR)a 1, 4, 5, 11 and 13 Korea Energy Management Corporation (KEMCO)c Perry Johnson Registrars Carbon Emissions Services (PJRCES)b	[[98, 103], [36, 39], [158, 164]]	[[61, 96], [0, 34], [106, 156]]	['KEMCO', 'KTR', 'PJRCES']	['Korea Energy Management Corporation', 'Korea Testing & Research Institute', 'Perry Johnson Registrars Carbon Emissions Services']
19	 63. In 2011, the Council approved plans of work for exploration for polymetallic nodules by Nauru Ocean Resources Inc. (NORI) (Nauru) and Tonga Offshore Mining Ltd. (TOML) (Tonga). 	[[121, 125], [167, 171], [174, 179], [128, 133]]	[[93, 119], [139, 165]]	['NORI', 'TOML', 'Tonga', 'Nauru']	['Nauru Ocean Resources Inc.', 'Tonga Offshore Mining Ltd.']
20	Expenditure for the period from 1 to 31 July 2008 as at 30 June 2009 a Represents $105,010,000 authorized under General Assembly resolution 62/259 of 20 June 2008, which was reduced by $63,351,000 under Assembly resolution 63/257 of 24 December 2008. United Nations Mission in Liberia (UNMIL)a Total expenditure (schedule 12.1)	[[286, 291]]	[[251, 284]]	['UNMIL']	['United Nations Mission in Liberia']
21	4.12. Consideration of draft amendments to existing Regulations submitted by GRRF The World Forum will consider the following proposal and may decide to submit it to the Administrative Committee of the 1958 Agreement (AC.1) with recommendations on its adoption by vote. 	[[218, 222], [77, 81]]	[[170, 206]]	['AC.1', 'GRRF']	['Administrative Committee of the 1958']
22	Strategic Partnership Division 702. In paragraph 16, the United Nations Entity for Gender Equality and the Empowerment of Women (UN-Women) agreed with the Board's recommendation that it strengthen its resources mobilization activities by expanding and diversifying its resource base through: (a) strengthening and expanding partnerships with bilateral and multilateral donors; (b) developing regionally based fundraising expertise; and (c) approaching socially responsible private sector entities, women's groups and individuals. 	[[129, 137]]	[[57, 127]]	['UN-Women']	['United Nations Entity for Gender Equality and the Empowerment of Women']
23	 S.D.N.Y. 2013) [keywords: presumption-habitual residence; centre of main interests (COMI)-timing; establishment] This application for recognition in the United States of America of the personal insolvency proceeding the debtor had commenced in London was contested by a major creditor who had sued the debtor in the United States and sought to avoid the stay that would arise automatically on recognition of the English proceedings under Chapter 15 of the United States Bankruptcy Code (enacting the Model Law in the United States).	[[85, 89]]	[[59, 83]]	['COMI']	['centre of main interests']
24	Ms. Sumi (Japan) said that her Government was boosting its international efforts on behalf of women.  In addition to ongoing efforts to develop an action plan on Security Council resolution 1325 (2000), it had implemented measures to prevent sexual violence in conflict and assist victims in several countries and was cooperating closely in that connection with the United Nations Entity for Gender Equality and the Empowerment of Women (UNWomen), the International Criminal Court and the Special Representative on Sexual Violence in Conflict. 	[[438, 445]]	[[366, 436]]	['UNWomen']	['United Nations Entity for Gender Equality and the Empowerment of Women']
25	The latest report of the Secretary-General to the Council on the United Nations operation in Cyprus was issued on 27 May 2005 (S/2005/353).  At its twenty-ninth to thirty-fourth and thirty-seventh sessions, the General Assembly considered the item (resolutions 3212 (XXIX), 3395 (XXX), 31/12, 32/15, 33/15, 34/30 and 37/253 and decisions 31/403, 32/404, 33/402, 34/408 and 37/455). 	[]	[]	[]	[]
26	SAT was engaged in the exploration, production, refining and distribution of Saudi Arabia’s 50 per cent share of the onshore hydrocarbon reserves in the PNZ.  The remaining 50 per cent interest in the hydrocarbon reserves of the PNZ is held onshore by Kuwait Oil Company (“KOC”), and offshore by the Arabian Oil. 	[[273, 276], [0, 3], [153, 156], [229, 232]]	[[252, 270]]	['KOC', 'SAT', 'PNZ', 'PNZ']	['Kuwait Oil Company']
27	One P-5 post and one P-3 have been redeployed from the secretariat of the Executive Committee on Peace and Security, Department of Political Affairs, and the General Legal Division, Office of Legal Affairs, respectively. One P-5 post has been redeployed from the Development Information Services Division, Economic Commission for Africa. One P-4 post and one P-2 post have been redeployed from the Emerging Social Issues Division and the Poverty and Development Division respectively, within the Economic and Social Commission for Asia and the Pacific (ESCAP); (d) One P-4 post has been redeployed from the Division for Sustainable Development, Department of Economic and Social Affairs, to the Administrative Law Unit, Office of Human Resources Management, to assist in handling the large number of disciplinary cases that have been referred to the Office.	[[553, 558]]	[[496, 551]]	['ESCAP']	['Economic and Social Commission for Asia and the Pacific']
28	The Committee heard statements in the general debate on agenda item 7 made by the representatives of Benin, Canada, Costa Rica, the Dominican Republic, El Salvador, Greece (on behalf of the European Union, and the acceding countries of Cyprus, the Czech Republic, Estonia, Hungary, Latvia, Lithuania, Malta, Poland, the Slovak Republic and Slovenia, the associated countries of Bulgaria, Romania and Turkey and EFTA country, member of the European Economic Area, Iceland, which aligning themselves with the statement,) Japan, Mexico, Namibia, New Zealand and Venezuela.  The representatives of the International Labour Organization (ILO), the Office of High Commissioner for Human Rights (HCHR) and the South African Human Rights Commission (on behalf of National Human Rights Institutions (NHRI)) made statements. 	[[633, 636], [689, 693], [791, 795], [411, 415]]	[[598, 631], [653, 687], [755, 789]]	['ILO', 'HCHR', 'NHRI', 'EFTA']	['International Labour Organization', 'High Commissioner for Human Rights', 'National Human Rights Institutions']
29	"1 (212) 499-5583).]  Panel discussion on ""Being gay, lesbian, bi-sexual and transgender in religious communities: A faith-based and human rights perspective"" (co-organized by the Permanent Mission of Israel and the Unitarian Universalist United Nations Office (UU-UNO)) Thursday, 4 April 2013, from 15:00 to 17:00, in Conference Room 2 (NLB)."	[[261, 267], [337, 340]]	[[215, 259]]	['UU-UNO', 'NLB']	['Unitarian Universalist United Nations Office']
30	 109. The National Commission for the Prevention and Eradication of Child Labour and the Protection of Adolescent Employment (CONAETI-Py) began a review of the National Plan for the Prevention and Elimination of Child Labour and the Protection of Adolescent Workers in 2009, through consultations with children and adolescents, as well as adults, from various organizations and movements, with a view to raising the issue of child labour, obtaining their input and ensuring that they participated fully and played a leading role in the review process. 	[[126, 136]]	[[10, 124]]	['CONAETI-Py']	['National Commission for the Prevention and Eradication of Child Labour and the Protection of Adolescent Employment']
31	IMPEL was represented at a workshop organized by the Secretariat for countries of Central and Eastern Europe in October 2006.  IMPEL, and the countries participating in the IMPEL Transfrontier Shipment (IMPEL-TFS) project, also provided valuable information that was used in the Training Manual for the Enforcement of Laws Implementing the Basel Convention: Guidance for Safe and Effective Detection, Investigation and Prosecution of Illegal Traffic in Hazardous and other Wastes. 	[[203, 212], [0, 5], [127, 132]]	[[173, 201]]	['IMPEL-TFS', 'IMPEL', 'IMPEL']	['IMPEL Transfrontier Shipment']
32	Global forum of non-governmental organizations on the review of the twentieth special session of the General Assembly Assessment of progress towards the goals set at the twentieth special session of the General Assembly Provision, maintenance and support of the electronic Programme and Financial Information Management System (ProFi) for United Nations Mine Action Service United Nations Office at Vienna	[[328, 333]]	[[273, 308]]	['ProFi']	['Programme and Financial Information']
33	To respond to growing demands for urban environmental planning and management expertise, UN-Habitat has been conducting capacity-building activities through a wide range of national training institutions in China, Cuba, Egypt, India, Nigeria, Peru, the Philippines, Senegal, Sri Lanka, Thailand, the United Republic of Tanzania and Zambia.  UN-Habitat is spearheading the development of the Sustainable Urban Development Network (SUD-Net), an innovative network focusing on promoting interdisciplinary approaches to sustainable urban development. 	[[430, 437], [89, 99], [341, 351]]	[[391, 428]]	['SUD-Net', 'UN-Habitat', 'UN-Habitat']	['Sustainable Urban Development Network']
34	(ii) Request and aggregate data from the NFCs in all recent grid systems used by EMEP deposition models; (iii) Ensure harmonization of data compatibility, processes and synergies between the NFCs and experts working with the EU Habitat Directive; (iv) Complement results for NFCs on site-specific dynamic modelling of vegetation changes, including updated version of the extended very simple dynamic model (VSD+) and increased number of sites; (d) The twenty-seventh meeting of the Programme Task Force and the twenty-first CCE workshop, to be held from 18 to 22 April 2011 in Bilthoven, the Netherlands, and the submission of the two respective reports.	[[407, 411], [524, 527], [41, 45], [191, 195], [81, 85], [225, 227], [275, 279], [228, 235]]	[[380, 405]]	['VSD+', 'CCE', 'NFCs', 'NFCs', 'EMEP', 'EU', 'NFCs', 'Habitat']	['very simple dynamic model']
35	Methodological issues under the Kyoto Protocol.  Implications of the establishment of new hydrochlorofluorocarbon-22 (HCFC-22) facilities seeking to obtain certified emission reductions for the destruction of hydrofluorocarbon-23 (HFC-23). Draft conclusions proposed by the Chair	[[118, 125], [231, 237]]	[[90, 116], [209, 229]]	['HCFC-22', 'HFC-23']	['hydrochlorofluorocarbon-22', 'hydrofluorocarbon-23']
36	Expert on contract with the Commonwealth Fund for Technical Cooperation, to the Government of Saint Lucia (October'96-October'99) Managed the National GPS survey of Saint Lucia (1999-2000) Director of the Lands and Surveys Division and Commissioner of State Lands, Government of Trinidad and Tobago (G.O.T.T.) (1989-1997) Managed the national GP control survey of Trinidad and Tobago. (	[[300, 308], [343, 345], [151, 154]]	[[265, 298]]	['G.O.T.T.', 'GP', 'GPS']	['Government of Trinidad and Tobago']
37	Friday, 28 September 2012, from 10:00 to 13:00 in Conference Room 3 (NLB).  Zone of Peace and Cooperation of the South Atlantic (ZPCSA) (organized by the Permanent Mission of Uruguay) Friday, 28 September 2012, from 15:00 to 18:00 in Conference Room D (NLB).	[[129, 134], [253, 256], [69, 72]]	[[76, 127]]	['ZPCSA', 'NLB', 'NLB']	['Zone of Peace and Cooperation of the South Atlantic']
38	"At its first session in 1999, the Committee recognized that the EDI used in earlier reviews had reflected some elements of vulnerability, but it felt that this reflection was inadequate to cover the Committee's notion of vulnerability as ""structural vulnerability"", defined as the risk of being negatively affected by unforeseen events beyond the control of a country.  The Committee, therefore, proposed that the former EDI be replaced by an economic vulnerability index (EVI).27 107."	[[473, 476], [64, 67], [421, 424]]	[[443, 471]]	['EVI', 'EDI', 'EDI']	['economic vulnerability index']
39	 Dates of Meetings involving GRE Experts: 19/05/2005 1st informal meeting of GRE experts on Emergency Stop Signals (GRE-ESS), Brussels 20/05/2005 1st informal joint meeting of the GRE-GRRF experts on ESS, Brussels	[[116, 123], [180, 188], [200, 203], [29, 32]]	[[77, 114]]	['GRE-ESS', 'GRE-GRRF', 'ESS', 'GRE']	['GRE experts on Emergency Stop Signals']
40	In order to promote networking, share national experiences, facilitate information flows and increase the impact of its work, the Commission is currently establishing an international network of science and technology institutions, including national science and technology commissions and other stakeholders in development.  Members of the Network will interact on-line through the Science and Technology for Development Network (STDev). 	[[431, 436]]	[[383, 421]]	['STDev']	['Science and Technology for Development']
41	The scheme extends the Government's 6 months' severance payments to ex-soldiers for a further 18 months.  A total of US$ 18.1 million has been pledged to this United Nations Development Programme (UNDP)-administered fund by donors who are convinced that a longer reintegration period for the ex-soldiers is prudent. 	[[197, 201], [117, 120]]	[[159, 195]]	['UNDP', 'US$']	['United Nations Development Programme']
42	 B. Refugee Children and Adolescents The Director of the Division of Operational Support (DOS) introduced the document EC/50/SC/CRP.7 entitled, Refugee Children and Adolescents: a Progress Report. 	[[90, 93]]	[[57, 88]]	['DOS']	['Division of Operational Support']
43	Recommendations 65 29 1. This document is a synthesis and preliminary analysis of information submitted by Parties and observers on operational objective 4 (OO 4) of the 10-year strategic plan and framework to enhance the implementation of the Convention (The Strategy): capacity-building. 	[[157, 161]]	[[132, 155]]	['OO 4']	['operational objective 4']
44	"1 (203) 918-7027; e-mail virginiaott@gmail.com).]  UNU Lecture Series ""Emerging Thinking on Global Issues: Explaining the Financial Crisis and What It Means for the Future of Global Development"" (organized by the United Nations University Office in New York (UNU-ONY)) Tuesday, 24 February 2009, from 3 to 4.30 p.m. in the Dag Hammarskjöld Library Auditorium."	[[259, 266], [51, 54], [311, 315]]	[[213, 257]]	['UNU-ONY', 'UNU', 'p.m.']	['United Nations University Office in New York']
45	(c) Strengthening of UNEP's work with sport organizations.  Through the Michezo programme, UNEP will strengthen its relationship with the International Olympic Committee (IOC) and forge similar partnerships with other sport federations and associations;. 	[[171, 174], [91, 95], [21, 27]]	[[138, 169]]	"['IOC', 'UNEP', ""UNEP's""]"	['International Olympic Committee']
46	Calculation of the mass flow The particulate masses MPT,cold and MPT,hot (g/test) shall be calculated as follows: MSAM = mass of diluted exhaust gas taken from the dilution tunnel for collecting particulates (kg) and	[[114, 118], [209, 211], [65, 68], [74, 80], [52, 55]]	[[121, 207]]	['MSAM', 'kg', 'MPT', 'g/test', 'MPT']	['mass of diluted exhaust gas taken from the dilution tunnel for collecting particulates']
