ID	text	acronyms	long-forms	acronyms-text	long-forms-text
186	 3. The General Assembly, at its forty-sixth session in 1991, adopted the United Nations New Agenda for the Development of Africa in the 1990s (UN-NADAF). The New Agenda kindled the hope that the end of the cold war would bring ample opportunities for international cooperation to promote Africa's development, especially at a time when many countries in the continent had embarked upon democratization and were vigorously pursuing economic reforms.	[[144, 152]]	[[74, 129]]	['UN-NADAF']	['United Nations New Agenda for the Development of Africa']
187	It was also mentioned that the European Commission maintained a central database of alternative dispute resolution bodies for consumer complaints, which were considered to be in conformity with the European Commission's Recommendations on Dispute Resolution.  According to a study prepared by the European Consumer Centres Network (ECC-Net), published in December 2009, approximately 12,000 cross-border complaints have been filed each year for the past three years within ECC-NET structure, out of which less than 500 resulted in alternative dispute settlement. 	[[332, 339], [473, 480]]	[[297, 330]]	['ECC-Net', 'ECC-NET']	['European Consumer Centres Network']
188	 6. Several presentations were devoted to improved space debris population models, such as EVOLVE 5.0 and LEGEND, a three-dimensional LEO to GEO evolution model, of NASA and the Meteoroid and Space Debris Terrestrial Reference Model (MASTER)-2001 of ESA. 	[[234, 240], [250, 253], [91, 97], [106, 112], [134, 137], [141, 144], [165, 169]]	[[178, 226]]	['MASTER', 'ESA', 'EVOLVE', 'LEGEND', 'LEO', 'GEO', 'NASA']	['Meteoroid and Space Debris Terrestrial Reference']
189	Inventory recalculations, in particular for Belarus, the Russian Federation and Ukraine Increases in emissions resulting from inventory recalculations (in particular for Australia, France and Germany) were offset by decreases in emissions in other countries (in particular for New Zealand, Spain and the United States of America) Abbreviations: EIT = Parties with economies in transition, GHG = greenhouse gas, LULUCF = land use, land-use change and forestry. 	[[389, 392], [411, 417], [345, 348]]	[[395, 409], [420, 458], [351, 387]]	['GHG', 'LULUCF', 'EIT']	['greenhouse gas', 'land use, land-use change and forestry', 'Parties with economies in transition']
190	The practices of the Procurement Division stood out in that regard and should therefore be emulated.  The report before the Committee described the improvements under way at the United Nations Development Programme (UNDP), the United Nations Children's Fund (UNICEF) and the United Nations Population Fund (UNFPA). 	[[216, 220], [259, 265], [307, 312]]	[[178, 214], [227, 257], [275, 305]]	['UNDP', 'UNICEF', 'UNFPA']	"['United Nations Development Programme', ""United Nations Children's Fund"", 'United Nations Population Fund']"
191	 8. In an effort to improve the level of security cooperation in the disputed areas in northern Iraq, the multinational force in Iraq (MNF-I) has engaged the Government of Iraq and the Kurdistan Regional Government in discussions on developing cooperative frameworks for Iraqi army and Kurdish Peshmerga units and police forces from both sides. 	[[135, 140]]	[[106, 133]]	['MNF-I']	['multinational force in Iraq']
192	Briefing of the Attorney General 135. All incidents reported to officers at regional police stations and district Criminal Investigation Departments (C.I.D.) are conveyed to the Domestic Violence and Child Abuse Office, which prepares a mandatory informative report for the Attorney General. 	[[150, 156]]	[[114, 148]]	['C.I.D.']	['Criminal Investigation Departments']
193	Decision XIX/14: Essential-use exemption for chlorofluorocarbon113 for aerospace applications in the Russian Federation Noting with appreciation the work done by the Technology and Economic Assessment Panel and its Chemicals Technical Options Committee, Taking into consideration that adequate identified alternatives for chlorofluorocarbon-113 (CFC-113) do not currently exist for use in the aerospace industry of the Russian Federation and that the search for its alternatives continues, as confirmed in the 2006 assessment report of the Technology and Economic Assessment Panel and its Chemicals Technical Options Committee, Noting the readiness of the Russian Federation to explore the possibility of importing CFC-113 for its aerospace industry needs from available global stocks in accordance with the recommendations of the Technology and Economic Assessment Panel and its Chemicals Technical Options Committee,	[[346, 353], [715, 722], [9, 15]]	[[322, 344]]	['CFC-113', 'CFC-113', 'XIX/14']	['chlorofluorocarbon-113']
194	"1 (212) 963-9684).]  Seminar on ""Mainstreaming migration into development planning"" (co-organized by the United Nations Institute for Training and Research (UNITAR), the International Organization for Migration (IOM), the United Nations Population Fund (UNFPA) and the MacArthur Foundation) Monday, 28 November 2011, from 10 a.m. to 1.15 p.m. in Conference Room 6 (NLB)."	[[157, 163], [212, 215], [254, 259], [365, 368], [269, 278], [325, 329], [338, 342]]	[[105, 155], [170, 210], [222, 252]]	['UNITAR', 'IOM', 'UNFPA', 'NLB', 'MacArthur', 'a.m.', 'p.m.']	['United Nations Institute for Training and Research', 'International Organization for Migration', 'United Nations Population Fund']
195	 14. A proposal for any of the main types of UN/CEFACT publications mentioned above must be accompanied by written expressions of support (see annex IV template at the end of this document) from three UN/CEFACT country heads of delegation (HODs). 	[[240, 244], [45, 47], [48, 54], [201, 203], [204, 210], [149, 151]]	[[219, 238]]	['HODs', 'UN', 'CEFACT', 'UN', 'CEFACT', 'IV']	['heads of delegation']
196	I. Introduction 1. The United Nations New Agenda for the Development of Africa in the 1990s (UN-NADAF) was adopted by the General Assembly in its resolution 46/151 of 18 December 1991, which also outlined a schedule for the periodic review of the New Agenda. 	[[93, 101]]	[[23, 78]]	['UN-NADAF']	['United Nations New Agenda for the Development of Africa']
197	 45. The Operation successfully completed the deployment of communications infrastructure and networking and voice services throughout Darfur, including the installation of voice and data services using a very small aperture terminal (VSAT) to all 28 team sites in the three sectors (10 in Sector North, 8 in Sector South and 10 in Sector West). 	[[235, 239]]	[[205, 233]]	['VSAT']	['very small aperture terminal']
198	c See note 15.  United Nations Mission in the Sudan (UNMIS)a Statement of income and expenditure and changes in reserves and fund balances for the period from 1 July 2004 to 9 July 2011 as at 30 June 2013	[[53, 58]]	[[16, 51]]	['UNMIS']	['United Nations Mission in the Sudan']
199	Procedures for the election of the members of the Executive Board of the United Nations Entity for Gender Equality and the Empowerment of Women (UNWomen) At its 48th plenary meeting, on 9 September 2010, the Economic and Social Council, recalling General Assembly resolution 64/289 of 2 July 2010: (a) Decided that the election of the forty-one members of the Executive Board of the United Nations Entity for Gender Equality and the Empowerment of Women (UN-Women) would be held as soon as possible and by early November 2010; (b) Also decided to discuss further the issue of the staggering of terms, so as to reach an agreement on the modalities prior to the elections.	[[455, 463], [145, 152]]	[[383, 453], [73, 143]]	['UN-Women', 'UNWomen']	['United Nations Entity for Gender Equality and the Empowerment of Women', 'United Nations Entity for Gender Equality and the Empowerment of Women']
200	Finally, UNICEF will continue to be an active member of the United Nations country team and the Humanitarian Country Team and a participant in key activities involving the United Nations.  UNICEF will collaborate on the EU Good Governance and Social Justice co-funded project, which involves UNICEF; the United Nations Development Programme; United Nations Educational, Scientific and Cultural Organization; and the United Nations Entity for Gender Equality and the Empowerment of Women (UN-Women). 	[[488, 496], [9, 15], [189, 195], [292, 298], [220, 222]]	[[416, 486]]	['UN-Women', 'UNICEF', 'UNICEF', 'UNICEF', 'EU']	['United Nations Entity for Gender Equality and the Empowerment of Women']
201	 115. Attention was drawn to the fact that the final review and appraisal of the United Nations New Agenda for the Development of Africa in the 1990s (UN-NADAF) would be conducted during the fifty-seventh session of the General Assembly. 	[[151, 159]]	[[81, 136]]	['UN-NADAF']	['United Nations New Agenda for the Development of Africa']
202	"1 (212) 310-1549).]  UNU midday forum on ""Reforming aid allocation criteria taking into account vulnerability"" (organized by the United Nations University Office in New York (UNU-ONY)) Thursday, 14 October 2010, from 1.15 to 2.30 p.m. in Conference Room E (NLB)."	[[175, 182], [257, 260], [230, 234], [21, 24]]	[[129, 173]]	['UNU-ONY', 'NLB', 'p.m.', 'UNU']	['United Nations University Office in New York']
203	I. INTRODUCTION 1. This note summarizes the replies to the questionnaire circulated in 2005 to participants in the 2004-2005 meetings of Working Party 7 (WP.7) and its specialized sections. 	[[154, 158]]	[[137, 152]]	['WP.7']	['Working Party 7']
204	The DOI is an important tool for international ICT performance evaluation and benchmarking and is updated annually.  Another WSIS-endorsed ICT indicator, the ICT Opportunity Index (ICT-OI), was launched during the Tunis phase and updated in February 2007. 	[[181, 187], [139, 142], [4, 7], [47, 50]]	[[158, 179]]	['ICT-OI', 'ICT', 'DOI', 'ICT']	['ICT Opportunity Index']
205	UN/EDIFACT messages and their support directories; Extended Mark-up Language (XML) Schemas; United Nations Electronic Trade Documents (UNeDocs); Procedures for the maintenance of the syntax solutions;	[[135, 142], [0, 10], [78, 81]]	[[92, 133], [51, 76]]	['UNeDocs', 'UN/EDIFACT', 'XML']	['United Nations Electronic Trade Documents', 'Extended Mark-up Language']
206	A. Scope of international obligations 1. The Irish Human Rights Commission (Irish-HRC) recommended that Ireland ratify the Convention on the Rights of Persons with disabilities; the Optional Protocol to the Convention against Torture and other Cruel, Inhuman or Degrading Treatment or Punishment; the Optional Protocol to the International Covenant on Economic, Social and Cultural Rights; the Optional Protocol to the Convention on the Rights of the Child on the sale of children, child prostitution and child pornography; the Convention on the Rights of Migrant Workers and All Members of their Families and; the Convention for the Protection of all Persons from Enforced Disappearance. 	[[76, 85]]	[[45, 74]]	['Irish-HRC']	['Irish Human Rights Commission']
207	 96. Nearest home are the activities specifically in the area of trade of the International Trade Centre UNCTAD/GATT (ITC), the GATT, and, in the near future, of the new World Trade Organization. 	[[118, 121], [105, 111], [112, 116], [128, 132]]	[[78, 104]]	['ITC', 'UNCTAD', 'GATT', 'GATT']	['International Trade Centre']
208	"A DPI short video will be screened at the beginning of the briefing.  UNU-UN forum on ""Limited resources for peacekeeping: Deciding where to go"" (organized by the United Nations University Office in New York (UNU-ONY)) Thursday, 3 April 2008, from 1.15 to 2.45 p.m. in Conference Room C."	[[209, 216], [2, 5], [70, 76], [261, 265]]	[[163, 207]]	['UNU-ONY', 'DPI', 'UNU-UN', 'p.m.']	['United Nations University Office in New York']
209	(a) Criminal Offences (Procedure) (Amendment) Bill to introduce plea bargaining.  (b) The Economic and Organized Crime Act which transformed the Serious Fraud Office into the Economic and Organized Crime Office, (EOCO) and provides comprehensively for confiscation of proceeds of crime. 	[[213, 217]]	[[175, 210]]	['EOCO']	['Economic and Organized Crime Office']
210	The view was expressed that the establishment of the Planning and Evaluation Unit would help to increase the support provided to the Office for Drug Control and Crime Prevention in developing result-oriented technical cooperation programmes and establishing close links between mandates and project activities.  Since 1 March 2002, access to basic financial data was being provided by the Programme and Financial Information System (ProFi); thus, Member States were able to obtain more detailed information on the operational activities of UNDCP. 	[[433, 438], [540, 545]]	[[389, 424]]	['ProFi', 'UNDCP']	['Programme and Financial Information']
211	 11. The United Nations Entity for Gender Equality and the Empowerment of Women (UN-Women) is mandated to provide, through its normative support functions and operational activities, guidance and technical support to all Member States, at their request, on gender equality, the empowerment and rights of women and gender mainstreaming. 	[[81, 89]]	[[9, 79]]	['UN-Women']	['United Nations Entity for Gender Equality and the Empowerment of Women']
212	"Kindly provide information on the set of 32 core indicators of the status of women and women's enjoyment of their rights mentioned in paragraph 20 and assess progress in the systematic use of gender and development indicators in policymaking in all relevant areas.  Among the significant results of the CIDA-supported Institutional Strengthening Project II (ISP-II) component on the ""Improvement of Statistics on Gender Issues"" from 1997 to 2002 , has been the strengthened commitment of key statistical agencies in addressing necessary data support for analysis of gender issues. "	[[358, 364], [303, 307]]	[[318, 356]]	['ISP-II', 'CIDA']	['Institutional Strengthening Project II']
213	The Department of Science and Technology coordinates and supports the S&T activity by providing grants in aid to 16 autonomous scientific institutions and professional bodies in the country.  It implements various programmes for augmentation of infrastructure at research institutions, provides scholarships and fellowships to encourage young scientists in research work and implements programmes for promoting and encouraging research in newly emerging/ advanced and challenging areas of science and engineering through a Science and Engineering Research Council(SERC) established in 1974. 	[[564, 568]]	[[523, 562]]	['SERC']	['Science and Engineering Research Counci']
214	"Despite this cautious approach, the Inspector notes in the report of the Secretary-General on information technology in the Secretariat: a plan of action, issued in 2001, that the Department of Public Information has undertaken the digitization of pre-1993 General Assembly and Security Council documents for loading onto ODS"".  In addition, on a web site maintained by that Department at http://www.un.org/Depts/dhl/landmark/amajor.htm, it is said that in 1998 DHL had initiated ""a programme to digitize all language editions of United Nations parliamentary documents issued from 1946 to 1992 for inclusion in the United Nations Official Document System (ODS)""and that this digitization project is one of many conducted by the Dag Hammarskjold Library in its continuing efforts to improve multilingual, electronic access to the documentation of the United Nations Organization"". "	[[656, 659], [322, 325], [462, 465]]	[[630, 654]]	['ODS', 'ODS', 'DHL']	['Official Document System']
215	 Further information on the GasAS Ccentre is available at: http://www.gascentre.unece.org/. The Energy Efficiency 21 (EE21) project (http://www.ee-21.net/) is a region-wide project aimed at enhancing trade and co-operation in energy efficient, environmentally sound technologies and management practices. 	[[118, 122], [28, 33]]	[[103, 116]]	['EE21', 'GasAS']	['Efficiency 21']
216	a Specify and list separately (e.g., GEF, Montreal Protocol, UNSO).  b Abbreviations: GEF = Global Environment Facility; IPF = indicative planning figures; SPPD = support for policy and programme development; STS = support for technical services; TCDC = technical cooperation among developing countries; TRAC = target for resource assignment from the core; UNCDF = United Nations Capital Development Fund; UNIFEM = United Nations Development Fund for Women; UNV = United Nations Volunteers; and UNSO = Office to Combat Desertification and Drought (previously the United Nations Sudano-Sahelian Office, now part of the UNDP Bureau for Policy and Programme Support). 	[[86, 89], [121, 124], [156, 160], [209, 212], [247, 251], [304, 308], [357, 362], [458, 461], [31, 35], [37, 40], [61, 65], [406, 412], [495, 499], [618, 622]]	[[92, 119], [127, 154], [215, 245], [254, 302], [311, 355], [365, 404], [464, 489], [163, 207], [415, 456], [502, 593]]	['GEF', 'IPF', 'SPPD', 'STS', 'TCDC', 'TRAC', 'UNCDF', 'UNV', 'e.g.', 'GEF', 'UNSO', 'UNIFEM', 'UNSO', 'UNDP']	['Global Environment Facility', 'indicative planning figures', 'support for technical services', 'technical cooperation among developing countries', 'target for resource assignment from the core', 'United Nations Capital Development Fund', 'United Nations Volunteers', 'support for policy and programme development', 'United Nations Development Fund for Women', 'Office to Combat Desertification and Drought (previously the United Nations Sudano-Sahelian']
217	B. Cooperation with human rights mechanisms 8. Joint Submission 3 (JS 3) stated that following the UPR in 2009 there has been no improvement in the human rights situation in Eritrea. 	[[67, 71], [99, 102]]	[[47, 65]]	['JS 3', 'UPR']	['Joint Submission 3']
218	In consumer and producer price statistics, the IMF will continue to conduct regional courses, provide hands-on training, and develop software packages based on UN and ILO methodologies that can be used by member countries.  The IMF serves as secretariat for the Technical Expert Group for Producer Price Indices (TEG-PPI) that is developing a revised manual on producer prices, maintains an Internet discussion group on this revision, and is an active participant in the IWGPS and the Technical Group for Consumer Price Indices (TEG-CPI). 	[[313, 320], [529, 536], [228, 231], [47, 50], [160, 162], [167, 170], [471, 476]]	[[262, 311], [485, 527]]	['TEG-PPI', 'TEG-CPI', 'IMF', 'IMF', 'UN', 'ILO', 'IWGPS']	['Technical Expert Group for Producer Price Indices', 'Technical Group for Consumer Price Indices']
219	Economic and Social Council Informal consultations Informal consultations on the draft resolution of the Economic and Social Council on the working relations between the Executive Board of the United Nations Entity for Gender Equality and the Empowerment of Women (UN-Women) and the Commission on the Status of Women, convened by the co-facilitators, Ms. Anne Hernando (Philippines) and Mr. Fernando Fernández-Arias (Spain), will be held on Tuesday, 11 December 2012, from 15:00 to 18:00, in Conference Room A (NLB); and on Wednesday, 12 December, from 15:00 to 18:00, in Conference Room C (NLB). 	[[265, 273], [591, 594], [511, 514]]	[[193, 263]]	['UN-Women', 'NLB', 'NLB']	['United Nations Entity for Gender Equality and the Empowerment of Women']
220	In addition, the Ministry of Defence noted the following advances in the area of gender equity: (1) the post of Senior Presidential Advisor on Gender Equity was created; and (2) a comprehensive policy framework was established that provides for the recognition of sexual and reproductive rights, the prevention of violence and aggression and the equal exercise of political (the Quota Act), social and cultural rights, among other important provisions.  With respect to ways of promoting the role of women in disarmament, nonproliferation and arms control, we suggest that (1) representatives of women's groups and associations be included in discussion panels and programmes on the topic; (2) advisory boards be established within national and international disarmament programmes, in coordination with the United Nations Entity for Gender Equality and the Empowerment of Women (UN-Women); and (3) military observatories for gender equality be promoted as entities providing technical and administrative support for the inclusion of women in such programmes. 	[[880, 888], [375, 388]]	[[808, 878]]	['UN-Women', 'the Quota Act']	['United Nations Entity for Gender Equality and the Empowerment of Women']
221	In addition to the contributions summarized in table 1, voluntary extrabudgetary contributions directly to the centres have been allocated over several years.  In 2006, the Meteorological Synthesizing Centre - West (MSC-West) received extrabudgetary contributions (either directly from its host institution, the Norwegian Meteorological Institute, or through projects financed by the Nordic Council of Ministers and the European Community) that totalled $576,383. 	[[216, 224]]	[[173, 214]]	['MSC-West']	['Meteorological Synthesizing Centre - West']
222	 455. Support was expressed for the activities proposed under section 31 (A-D). 	[[74, 77]]	[]	['A-D']	[]
223	 Subtotal , Section III abbreviations: EU = European Union; GIZ = German International Cooperation Agency; OCHA = United Nations Office for the Coordination of Humanitarian Affairs; OECD = Organization for Economic Cooperation and Development; UNDP = United Nations Development Programme; UNEP = United Nations Environment Programme; E = expert provided in kind; E+T = expert provided in kind, together with their travel and subsistence. 	[[39, 41], [182, 186], [244, 248], [289, 293], [60, 63], [107, 111], [363, 366]]	[[44, 58], [189, 242], [251, 287], [296, 332], [66, 105], [114, 180], [338, 361], [369, 436]]	['EU', 'OECD', 'UNDP', 'UNEP', 'GIZ', 'OCHA', 'E+T']	['European Union', 'Organization for Economic Cooperation and Development', 'United Nations Development Programme', 'United Nations Environment Programme', 'German International Cooperation Agency', 'United Nations Office for the Coordination of Humanitarian Affairs', 'expert provided in kind', 'expert provided in kind, together with their travel and subsistence']
224	The provinces most affected were those that witnessed the most extensive and prolonged fighting, including Moxico, Kuando Kubango, and Bie.  Therefore these provinces have the highest number of mine fields and are highly impacted, according to the Landmine Impact Survey (LIS). 	[[272, 275]]	[[248, 270]]	['LIS']	['Landmine Impact Survey']
225	Calls upon Member States to give due consideration to the updated Model Strategies and Practical Measures on the Elimination of Violence against Women in the Field of Crime Prevention and Criminal Justice in order to strengthen national responses to gender-related killing of women and girls; 9. Encourages relevant United Nations entities and agencies, in particular the United Nations Office on Drugs and Crime, the Commission on the Status of Women, the Office of the United Nations High Commissioner for Human Rights and the United Nations Entity for Gender Equality and the Empowerment of Women (UN-Women), to support Member States in developing and implementing strategies and policies, upon request, at the national, regional and international levels to address and prevent gender-related killing of women and girls; 10.	[[601, 609]]	[[529, 599]]	['UN-Women']	['United Nations Entity for Gender Equality and the Empowerment of Women']
226	On the night of 25 to 26 February, approximately 5,000 Peshmerga troops entered the Kirkuk governorate from the Kurdistan region.  Without announcement, the troops passed through the Kirkuk combined security area established through the combined security mechanism between KRG, the United States Forces in Iraq (USF-I) and the Iraqi Government, taking up positions to the west, south and south-west of the area. 	[[312, 317], [273, 276]]	[[282, 310]]	['USF-I', 'KRG']	['United States Forces in Iraq']
227	A. Organizational structure of the United Nations Mission for the Referendum in Western Sahara 2010-2011 Abbreviations: ASG = Assistant Secretary-General; FS = Field Service; NS = National Staff; UNV = United Nations Volunteers; GPP = Government-Provided Personnel; UNMO = United Nations military observer; SS = support staff (military). 	[[155, 157], [175, 177], [196, 199], [266, 270], [307, 309], [229, 232], [120, 123]]	[[160, 173], [180, 194], [202, 227], [273, 305], [312, 325], [235, 264], [126, 153]]	['FS', 'NS', 'UNV', 'UNMO', 'SS', 'GPP', 'ASG']	['Field Service', 'National Staff', 'United Nations Volunteers', 'United Nations military observer', 'support staff', 'Government-Provided Personnel', 'Assistant Secretary-General']
228	Parties in Myanmar 1. Democratic Karen Benevolent Army (DKBA)a 2.	[[56, 60]]	[[22, 54]]	['DKBA']	['Democratic Karen Benevolent Army']
229	:: UNU World Institute for Development Economics Research (UNU-WIDER), Helsinki Programmes :: UNU Programme for Biotechnology in Latin America and the Caribbean (UNU-BIOLAC), Caracas :: UNU Food and Nutrition Programme for Human and Social Development (UNU-FNP), Ithaca, New York, United States of America	[[162, 172], [59, 68], [253, 260]]	[[94, 160], [186, 251], [3, 57]]	['UNU-BIOLAC', 'UNU-WIDER', 'UNU-FNP']	['UNU Programme for Biotechnology in Latin America and the Caribbean', 'UNU Food and Nutrition Programme for Human and Social Development', 'UNU World Institute for Development Economics Research']
230	Coal and Metal Community of the CIS Energy Charter Eurasian Economic Community (EurAsEC) IEA IEACCC IEAGHG International Energy Forum	[[80, 87], [32, 35], [89, 92], [93, 99], [100, 106]]	[[51, 78]]	['EurAsEC', 'CIS', 'IEA', 'IEACCC', 'IEAGHG']	['Eurasian Economic Community']
